{
  "fixture_id": "fixture-pan-blurred",
  "document_type": "PAN",
  "variant": "blurred",
  "synthetic": true,
  "watermark_text": "SAMPLE - NOT VALID",
  "image_file": "pan_blurred.png",
  "image_sha256": "8611ee106a2469c02d1c945a0d77d6b694492451272f324fe9ab6fbc788986a7",
  "expected_readability": "Unreadable",
  "expected_completeness": "Complete",
  "expected_profile_consistency": "NotEvaluated",
  "expected_fields": {
    "name": null,
    "date_of_birth": null,
    "masked_pan": null
  }
}
