{
  "fixture_id": "fixture-pan-profile-mismatch",
  "document_type": "PAN",
  "variant": "profile_mismatch",
  "synthetic": true,
  "watermark_text": "SAMPLE - NOT VALID",
  "image_file": "pan_profile_mismatch.png",
  "image_sha256": "2e112f3e74afaae75ac5a1c7ec3593cdaf4c26448f24afd074b28e2b10bb4afc",
  "expected_readability": "Readable",
  "expected_completeness": "Complete",
  "expected_profile_consistency": "Mismatch",
  "expected_fields": {
    "name": "Riya Sen",
    "date_of_birth": "09/04/2004",
    "masked_pan": "ABCDE****F"
  }
}
