{
  "fixture_id": "fixture-pan-incomplete",
  "document_type": "PAN",
  "variant": "incomplete",
  "synthetic": true,
  "watermark_text": "SAMPLE - NOT VALID",
  "image_file": "pan_incomplete.png",
  "image_sha256": "d64154b86fa4165bc85a09e38626389c3f1cfd78754470f0eccb15af8ce91e36",
  "expected_readability": "Readable",
  "expected_completeness": "Incomplete",
  "expected_profile_consistency": "NotEvaluated",
  "expected_fields": {
    "name": "Aarav Kulkarni",
    "date_of_birth": null,
    "masked_pan": null
  }
}
